{
  "schema_version": "1.0.0",
  "match_id": "demo-0001",
  "seed": 20261026,
  "sim_hz": 25,
  "period_duration_s": 2700.0,
  "pitch": {
    "length_m": 105.0,
    "width_m": 68.0,
    "goal_width_m": 7.32,
    "goal_height_m": 2.44
  },
  "home": {
    "side": "home",
    "name": "Harbour City Mariners",
    "short_name": "HCM",
    "city": "Harbour City",
    "formation": "4-3-3",
    "kit": {
      "primary": "#0b3d91",
      "secondary": "#f2f4f8",
      "accent": "#4cc9f0",
      "number": "#ffffff",
      "pattern": "plain"
    },
    "gk_kit": {
      "primary": "#2dc653",
      "secondary": "#0d1b2a",
      "accent": "#ffffff",
      "number": "#0d1b2a",
      "pattern": "plain"
    },
    "crest": {
      "shape": "shield",
      "monogram": "HC",
      "primary": "#0b3d91",
      "secondary": "#4cc9f0",
      "emblem": "anchor"
    },
    "players": [
      {
        "id": "H01",
        "team": "home",
        "first_name": "Tomás",
        "last_name": "Varga",
        "display_name": "Varga",
        "shirt_number": 1,
        "position": "GK",
        "archetype": "sweeper_keeper",
        "preferred_foot": "right",
        "weak_foot": 1,
        "height_cm": 172,
        "nationality": "NGA",
        "attributes": {
          "pace": 48,
          "acceleration": 61,
          "stamina": 53,
          "strength": 66,
          "jumping": 58,
          "short_passing": 50,
          "long_passing": 63,
          "vision": 55,
          "crossing": 68,
          "curve": 60,
          "technique": 52,
          "dribbling": 65,
          "finishing": 57,
          "shot_power": 49,
          "long_shots": 62,
          "volleys": 54,
          "heading": 67,
          "composure": 59,
          "tackling": 51,
          "interceptions": 64,
          "marking": 56,
          "positioning": 48,
          "gk_reflexes": 61,
          "gk_diving": 53,
          "gk_handling": 66,
          "gk_positioning": 58,
          "gk_distribution": 50
        },
        "physical": {
          "max_speed_mps": 8.76,
          "max_accel_mps2": 4.16,
          "max_decel_mps2": 5.23,
          "reaction_time_s": 0.2,
          "jump_reach_m": 2.6
        },
        "starter": true
      },
      {
        "id": "H02",
        "team": "home",
        "first_name": "Kofi",
        "last_name": "Mensah",
        "display_name": "Mensah",
        "shirt_number": 2,
        "position": "RB",
        "archetype": "overlapping_fullback",
        "preferred_foot": "right",
        "weak_foot": 2,
        "height_cm": 176,
        "nationality": "ESP",
        "attributes": {
          "pace": 60,
          "acceleration": 73,
          "stamina": 65,
          "strength": 57,
          "jumping": 70,
          "short_passing": 62,
          "long_passing": 75,
          "vision": 67,
          "crossing": 59,
          "curve": 72,
          "technique": 64,
          "dribbling": 56,
          "finishing": 69,
          "shot_power": 61,
          "long_shots": 74,
          "volleys": 66,
          "heading": 58,
          "composure": 71,
          "tackling": 63,
          "interceptions": 55,
          "marking": 68,
          "positioning": 60,
          "gk_reflexes": 23,
          "gk_diving": 23,
          "gk_handling": 23,
          "gk_positioning": 23,
          "gk_distribution": 23
        },
        "physical": {
          "max_speed_mps": 9.05,
          "max_accel_mps2": 4.42,
          "max_decel_mps2": 5.47,
          "reaction_time_s": 0.2,
          "jump_reach_m": 2.6
        },
        "starter": true
      },
      {
        "id": "H05",
        "team": "home",
        "first_name": "Rhys",
        "last_name": "Calloway",
        "display_name": "Calloway",
        "shirt_number": 5,
        "position": "RCB",
        "archetype": "ball_playing_centre_back",
        "preferred_foot": "right",
        "weak_foot": 3,
        "height_cm": 180,
        "nationality": "FRA",
        "attributes": {
          "pace": 72,
          "acceleration": 64,
          "stamina": 77,
          "strength": 69,
          "jumping": 82,
          "short_passing": 74,
          "long_passing": 66,
          "vision": 79,
          "crossing": 71,
          "curve": 63,
          "technique": 76,
          "dribbling": 68,
          "finishing": 81,
          "shot_power": 73,
          "long_shots": 65,
          "volleys": 78,
          "heading": 70,
          "composure": 62,
          "tackling": 75,
          "interceptions": 67,
          "marking": 80,
          "positioning": 72,
          "gk_reflexes": 26,
          "gk_diving": 26,
          "gk_handling": 26,
          "gk_positioning": 26,
          "gk_distribution": 26
        },
        "physical": {
          "max_speed_mps": 9.35,
          "max_accel_mps2": 4.22,
          "max_decel_mps2": 5.29,
          "reaction_time_s": 0.2,
          "jump_reach_m": 2.6
        },
        "starter": true
      },
      {
        "id": "H04",
        "team": "home",
        "first_name": "Idris",
        "last_name": "Okafor",
        "display_name": "Okafor",
        "shirt_number": 4,
        "position": "LCB",
        "archetype": "stopper",
        "preferred_foot": "right",
        "weak_foot": 4,
        "height_cm": 184,
        "nationality": "GHA",
        "attributes": {
          "pace": 84,
          "acceleration": 76,
          "stamina": 89,
          "strength": 81,
          "jumping": 73,
          "short_passing": 86,
          "long_passing": 78,
          "vision": 70,
          "crossing": 83,
          "curve": 75,
          "technique": 88,
          "dribbling": 80,
          "finishing": 72,
          "shot_power": 85,
          "long_shots": 77,
          "volleys": 69,
          "heading": 82,
          "composure": 74,
          "tackling": 87,
          "interceptions": 79,
          "marking": 71,
          "positioning": 84,
          "gk_reflexes": 29,
          "gk_diving": 29,
          "gk_handling": 29,
          "gk_positioning": 29,
          "gk_distribution": 29
        },
        "physical": {
          "max_speed_mps": 9.64,
          "max_accel_mps2": 4.49,
          "max_decel_mps2": 5.54,
          "reaction_time_s": 0.2,
          "jump_reach_m": 2.6
        },
        "starter": true
      },
      {
        "id": "H03",
        "team": "home",
        "first_name": "Lukas",
        "last_name": "Brandt",
        "display_name": "Brandt",
        "shirt_number": 3,
        "position": "LB",
        "archetype": "inverted_fullback",
        "preferred_foot": "left",
        "weak_foot": 5,
        "height_cm": 188,
        "nationality": "BRA",
        "attributes": {
          "pace": 66,
          "acceleration": 58,
          "stamina": 50,
          "strength": 63,
          "jumping": 55,
          "short_passing": 47,
          "long_passing": 60,
          "vision": 52,
          "crossing": 65,
          "curve": 57,
          "technique": 49,
          "dribbling": 62,
          "finishing": 54,
          "shot_power": 46,
          "long_shots": 59,
          "volleys": 51,
          "heading": 64,
          "composure": 56,
          "tackling": 48,
          "interceptions": 61,
          "marking": 53,
          "positioning": 66,
          "gk_reflexes": 32,
          "gk_diving": 32,
          "gk_handling": 32,
          "gk_positioning": 32,
          "gk_distribution": 32
        },
        "physical": {
          "max_speed_mps": 9.2,
          "max_accel_mps2": 4.09,
          "max_decel_mps2": 5.17,
          "reaction_time_s": 0.2,
          "jump_reach_m": 2.6
        },
        "starter": true
      },
      {
        "id": "H06",
        "team": "home",
        "first_name": "Mateo",
        "last_name": "Quiroga",
        "display_name": "Quiroga",
        "shirt_number": 6,
        "position": "DM",
        "archetype": "deep_lying_playmaker",
        "preferred_foot": "right",
        "weak_foot": 1,
        "height_cm": 192,
        "nationality": "JPN",
        "attributes": {
          "pace": 57,
          "acceleration": 70,
          "stamina": 62,
          "strength": 54,
          "jumping": 67,
          "short_passing": 59,
          "long_passing": 72,
          "vision": 64,
          "crossing": 56,
          "curve": 69,
          "technique": 61,
          "dribbling": 53,
          "finishing": 66,
          "shot_power": 58,
          "long_shots": 71,
          "volleys": 63,
          "heading": 55,
          "composure": 68,
          "tackling": 60,
          "interceptions": 73,
          "marking": 65,
          "positioning": 57,
          "gk_reflexes": 20,
          "gk_diving": 20,
          "gk_handling": 20,
          "gk_positioning": 20,
          "gk_distribution": 20
        },
        "physical": {
          "max_speed_mps": 8.98,
          "max_accel_mps2": 4.36,
          "max_decel_mps2": 5.41,
          "reaction_time_s": 0.2,
          "jump_reach_m": 2.6
        },
        "starter": true
      },
      {
        "id": "H08",
        "team": "home",
        "first_name": "Sami",
        "last_name": "Haddad",
        "display_name": "Haddad",
        "shirt_number": 8,
        "position": "RCM",
        "archetype": "box_to_box",
        "preferred_foot": "right",
        "weak_foot": 2,
        "height_cm": 174,
        "nationality": "IRL",
        "attributes": {
          "pace": 69,
          "acceleration": 61,
          "stamina": 74,
          "strength": 66,
          "jumping": 79,
          "short_passing": 71,
          "long_passing": 63,
          "vision": 76,
          "crossing": 68,
          "curve": 60,
          "technique": 73,
          "dribbling": 65,
          "finishing": 78,
          "shot_power": 70,
          "long_shots": 62,
          "volleys": 75,
          "heading": 67,
          "composure": 80,
          "tackling": 72,
          "interceptions": 64,
          "marking": 77,